{
  "$schema": "https://json-schema.org/draft/2020-12/schema",
  "description": "Candidate entry for the OSPD process-type register (Activity 4). A process type classifies the\nactivities recorded in provenance: a provenance Activity of this type carries the entry `id` as\nits `activityType`. The entry is modelled as a SKOS concept; openEO equivalences use the SKOS\nmapping properties.\n\nThe entry describes the *type* of activity only. What an activity of this type executes -- its\nplan, a `prov:Plan` -- is kept apart in `plan`: the OGC Application Package served by OGC API -\nProcesses - Part 2 (Deploy, Replace, Undeploy) at `/processes/{processID}/package`, whose\nexecution unit is the pinned CWL. A run of this type records the same IRI as its\n`qualifiedAssociation.hadPlan`. A process implemented natively by its server (`mutable: false`)\nhas no Application Package (Part 2 serves `/package` only for dynamically deployed processes)\nand so no `plan`; `processDescription` is then the only link to what is executed.\n",
  "type": "object",
  "required": [
    "id",
    "type",
    "prefLabel",
    "definition",
    "inScheme",
    "status",
    "phase",
    "profile",
    "processDescription",
    "provenanceClass",
    "openeoEquivalence"
  ],
  "properties": {
    "id": {
      "description": "IRI of the process type (also used as `activityType` in provenance records).",
      "type": "string",
      "format": "uri",
      "x-jsonld-id": "@id"
    },
    "type": {
      "const": "ProcessType",
      "x-jsonld-id": "@type"
    },
    "prefLabel": {
      "type": "string",
      "x-jsonld-id": "http://www.w3.org/2004/02/skos/core#prefLabel"
    },
    "definition": {
      "type": "string",
      "x-jsonld-id": "http://www.w3.org/2004/02/skos/core#definition"
    },
    "inScheme": {
      "description": "IRI of the process-type register (concept scheme) this entry is proposed to.",
      "type": "string",
      "format": "uri",
      "x-jsonld-id": "http://www.w3.org/2004/02/skos/core#inScheme",
      "x-jsonld-type": "@id"
    },
    "status": {
      "description": "ISO 19135 item status. Entries produced here are candidates, hence `submitted` at most.",
      "type": "string",
      "enum": [
        "submitted",
        "valid",
        "invalid",
        "superseded",
        "retired"
      ],
      "x-jsonld-id": "https://geolabs.github.io/bblocks-process-profiles/def/status"
    },
    "phase": {
      "description": "Position(s) in the six-phase workflow framework.",
      "type": "array",
      "minItems": 1,
      "items": {
        "type": "string",
        "enum": [
          "https://geolabs.github.io/bblocks-process-profiles/def/phase/filter-configuration",
          "https://geolabs.github.io/bblocks-process-profiles/def/phase/selection-filtering",
          "https://geolabs.github.io/bblocks-process-profiles/def/phase/data-retrieval",
          "https://geolabs.github.io/bblocks-process-profiles/def/phase/pre-processing",
          "https://geolabs.github.io/bblocks-process-profiles/def/phase/scientific-computation",
          "https://geolabs.github.io/bblocks-process-profiles/def/phase/export-aggregation"
        ]
      },
      "x-jsonld-id": "http://www.w3.org/2004/02/skos/core#broader",
      "x-jsonld-type": "@id"
    },
    "profile": {
      "description": "Identifier of the process-profile Building Block.",
      "type": "string",
      "x-jsonld-id": "https://geolabs.github.io/bblocks-process-profiles/def/profile"
    },
    "processDescription": {
      "description": "The OGC API - Processes processDescription this type is profiled from, at `href` (the `/processes/{processID}` resource). For a CWL-sourced process it is the description the Application Package would deploy, under the illustrative host `ospd.example.org`; for a live process (e.g. a ZOO-Project deployment, `ospd.process-profiles.sqlmm.*`) the real one.",
      "type": "object",
      "required": [
        "id",
        "version",
        "href"
      ],
      "properties": {
        "id": {
          "type": "string",
          "x-jsonld-id": "@id"
        },
        "version": {
          "type": "string",
          "x-jsonld-id": "https://geolabs.github.io/bblocks-process-profiles/def/version"
        },
        "href": {
          "type": "string",
          "format": "uri",
          "x-jsonld-id": "http://www.w3.org/2000/01/rdf-schema#seeAlso",
          "x-jsonld-type": "@id"
        },
        "license": {
          "description": "Of a live process; omitted, not null, when it declares none -- do not assume one.",
          "type": "string",
          "format": "uri",
          "x-jsonld-id": "http://purl.org/dc/terms/license",
          "x-jsonld-type": "@id"
        }
      },
      "x-jsonld-id": "https://geolabs.github.io/bblocks-process-profiles/def/processDescription"
    },
    "plan": {
      "description": "The plan (`prov:Plan`) an activity of this type executes: the OGC Application Package at `/processes/{processID}/package` (OGC API - Processes - Part 2, requirement /req/deploy-replace-undeploy/package-get-op), whose `executionUnit` is the pinned CWL. Present only for a CWL-sourced process.",
      "type": "object",
      "required": [
        "id",
        "type",
        "executionUnit",
        "cwlClass",
        "cwlId"
      ],
      "properties": {
        "id": {
          "type": "string",
          "format": "uri",
          "pattern": "/processes/[^/]+/package$",
          "x-jsonld-id": "@id"
        },
        "type": {
          "const": "Plan",
          "x-jsonld-id": "@type"
        },
        "executionUnit": {
          "description": "Same link as the Application Package's own `executionUnit` (examples/ogcapppkg.json).",
          "type": "object",
          "required": [
            "href",
            "type"
          ],
          "properties": {
            "href": {
              "description": "Pinned URL of the CWL document.",
              "type": "string",
              "format": "uri",
              "x-jsonld-id": "http://www.w3.org/ns/oa#hasTarget",
              "x-jsonld-type": "@id"
            },
            "type": {
              "type": "string",
              "x-jsonld-id": "http://purl.org/dc/terms/format"
            },
            "rel": {
              "type": "string",
              "x-jsonld-id": "http://www.iana.org/assignments/relation",
              "x-jsonld-type": "@id",
              "x-jsonld-base": "http://www.iana.org/assignments/relation/"
            }
          },
          "x-jsonld-id": "https://w3id.org/ogc/api/processes/executionUnit"
        },
        "cwlClass": {
          "enum": [
            "CommandLineTool",
            "Workflow",
            "ExpressionTool"
          ],
          "x-jsonld-id": "https://geolabs.github.io/bblocks-process-profiles/def/cwlClass"
        },
        "cwlId": {
          "type": "string",
          "x-jsonld-id": "https://geolabs.github.io/bblocks-process-profiles/def/cwlId"
        },
        "license": {
          "type": "string",
          "format": "uri",
          "x-jsonld-id": "http://purl.org/dc/terms/license",
          "x-jsonld-type": "@id"
        },
        "cctDependencies": {
          "description": "EOAP CWL custom types used by the CWL.",
          "type": "array",
          "items": {
            "type": "string",
            "pattern": "^eoap\\.cct\\."
          },
          "x-jsonld-id": "https://geolabs.github.io/bblocks-process-profiles/def/cctDependency"
        },
        "candidateCctDependencies": {
          "description": "EOAP CWL custom types that could replace plain CWL types (not used by the CWL).",
          "type": "array",
          "items": {
            "type": "string",
            "pattern": "^eoap\\.cct\\."
          },
          "x-jsonld-id": "https://geolabs.github.io/bblocks-process-profiles/def/candidateCctDependency"
        }
      },
      "x-jsonld-id": "https://geolabs.github.io/bblocks-process-profiles/def/plan"
    },
    "provenanceClass": {
      "description": "Class of the run records produced by executing this process.",
      "type": "string",
      "enum": [
        "http://purl.org/wf4ever/wfprov#ProcessRun",
        "http://purl.org/wf4ever/wfprov#WorkflowRun"
      ],
      "x-jsonld-id": "https://geolabs.github.io/bblocks-process-profiles/def/provenanceClass",
      "x-jsonld-type": "@id"
    },
    "implementsProfile": {
      "description": "IRI of the nearest applicable profile this process specialises, in the generic-profiles register -- normally an Implementation Profile (generic-profiles.implementation-profile.*, OGC 14-065 WPS 2.0.2 \u00a77.5.3: standard data formats, still not one specific deployment's own choice), or a Generic Profile directly when no Implementation Profile exists yet. Optional: most processes have no standardised abstract counterpart at all. `processDescription` and `plan` (this entry's own concrete binding) are what further specialise it to one real, deployed process -- Implementation (instance level) in the same standard's terms.",
      "type": "string",
      "format": "uri",
      "x-jsonld-id": "https://geolabs.github.io/bblocks-process-profiles/def/implementsProfile",
      "x-jsonld-type": "@id"
    },
    "hasStep": {
      "description": "Process types of the steps of a Workflow.",
      "type": "array",
      "items": {
        "type": "string",
        "format": "uri"
      },
      "x-jsonld-id": "https://geolabs.github.io/bblocks-process-profiles/def/hasStep",
      "x-jsonld-type": "@id"
    },
    "exactMatch": {
      "type": "array",
      "items": {
        "type": "string",
        "format": "uri"
      },
      "x-jsonld-id": "http://www.w3.org/2004/02/skos/core#exactMatch",
      "x-jsonld-type": "@id"
    },
    "closeMatch": {
      "type": "array",
      "items": {
        "type": "string",
        "format": "uri"
      },
      "x-jsonld-id": "http://www.w3.org/2004/02/skos/core#closeMatch",
      "x-jsonld-type": "@id"
    },
    "relatedMatch": {
      "type": "array",
      "items": {
        "type": "string",
        "format": "uri"
      },
      "x-jsonld-id": "http://www.w3.org/2004/02/skos/core#relatedMatch",
      "x-jsonld-type": "@id"
    },
    "openeoEquivalence": {
      "type": "object",
      "required": [
        "level",
        "rationale"
      ],
      "properties": {
        "level": {
          "enum": [
            "exactMatch",
            "closeMatch",
            "none"
          ],
          "x-jsonld-id": "https://geolabs.github.io/bblocks-process-profiles/def/equivalenceLevel"
        },
        "rationale": {
          "type": "string",
          "x-jsonld-id": "https://geolabs.github.io/bblocks-process-profiles/def/rationale"
        },
        "decomposition": {
          "description": "Ordered correspondence of the stages of a composite or opaque process.",
          "type": "array",
          "items": {
            "type": "object",
            "required": [
              "stage",
              "level"
            ],
            "properties": {
              "stage": {
                "type": "string",
                "x-jsonld-id": "https://geolabs.github.io/bblocks-process-profiles/def/stage"
              },
              "openeo": {
                "type": "array",
                "items": {
                  "type": "string",
                  "pattern": "^ogc\\.openeo\\."
                },
                "x-jsonld-id": "https://geolabs.github.io/bblocks-process-profiles/def/openeo"
              },
              "level": {
                "enum": [
                  "exactMatch",
                  "closeMatch",
                  "none"
                ],
                "x-jsonld-id": "https://geolabs.github.io/bblocks-process-profiles/def/equivalenceLevel"
              },
              "note": {
                "type": "string",
                "x-jsonld-id": "http://www.w3.org/2004/02/skos/core#note"
              }
            }
          },
          "x-jsonld-id": "https://geolabs.github.io/bblocks-process-profiles/def/decomposition",
          "x-jsonld-container": "@list"
        }
      },
      "x-jsonld-id": "https://geolabs.github.io/bblocks-process-profiles/def/openeoEquivalence"
    }
  },
  "x-jsonld-extra-terms": {
    "ProcessType": "http://www.w3.org/2004/02/skos/core#Concept",
    "Plan": "http://www.w3.org/ns/prov#Plan"
  },
  "x-jsonld-prefixes": {
    "skos": "http://www.w3.org/2004/02/skos/core#",
    "prov": "http://www.w3.org/ns/prov#",
    "pp": "https://geolabs.github.io/bblocks-process-profiles/def/",
    "rdfs": "http://www.w3.org/2000/01/rdf-schema#",
    "dct": "http://purl.org/dc/terms/",
    "oa": "http://www.w3.org/ns/oa#"
  }
}