{
  "id": "https://geolabs.github.io/bblocks-process-profiles/def/process-type/sqlmm/disjoint",
  "type": "ProcessType",
  "prefLabel": "Disjoint",
  "definition": "This servuce shall return a true value if and only if the geometries g1 and g2 have no point in common.",
  "inScheme": "https://geolabs.github.io/bblocks-process-profiles/def/process-type",
  "status": "submitted",
  "phase": [
    "https://geolabs.github.io/bblocks-process-profiles/def/phase/scientific-computation"
  ],
  "profile": "ospd.process-profiles.sqlmm.disjoint",
  "processDescription": {
    "id": "Disjoint",
    "version": "2.0.0",
    "href": "https://host1.tb.geonovum.geolabs.fr/ogc-api/processes/Disjoint"
  },
  "provenanceClass": "http://purl.org/wf4ever/wfprov#ProcessRun",
  "implementsProfile": "https://geolabs.github.io/bblocks-generic-profiles/def/implementation-profile/disjoint",
  "openeoEquivalence": {
    "level": "none",
    "rationale": "No openEO process for this SQL/MM predicate in the published bblocks-openeo register."
  }
}