{
  "id": "https://geolabs.github.io/bblocks-process-profiles/def/process-type/terrain/terrain-ruggedness-index",
  "type": "ProcessType",
  "prefLabel": "Terrain Ruggedness Index (TRI)",
  "definition": "References:&lt;br/&gt;Riley, S.J., De Gloria, S.D., Elliot, R. (1999): A Terrain Ruggedness that Quantifies Topographic Heterogeneity. Intermountain Journal of Science, Vol.5, No.1-4, pp.23-27. &lt;a href=\"http://www.fw.msu.edu/~rileysh2/Terrain%20Ruggedness%20Index.pdf\"&gt;online&lt;/a&gt;.&lt;br/&gt;",
  "inScheme": "https://geolabs.github.io/bblocks-process-profiles/def/process-type",
  "status": "submitted",
  "phase": [
    "https://geolabs.github.io/bblocks-process-profiles/def/phase/scientific-computation"
  ],
  "profile": "ospd.process-profiles.terrain.terrain-ruggedness-index",
  "processDescription": {
    "id": "SAGA.ta_morphometry.16",
    "version": "1.0.0",
    "href": "https://host1.tb.geonovum.geolabs.fr/ogc-api/processes/SAGA.ta_morphometry.16"
  },
  "provenanceClass": "http://purl.org/wf4ever/wfprov#ProcessRun",
  "implementsProfile": "https://geolabs.github.io/bblocks-generic-profiles/def/implementation-profile/terrain-ruggedness-index",
  "openeoEquivalence": {
    "level": "none",
    "rationale": "No openEO process computes a terrain ruggedness index in the published bblocks-openeo register."
  }
}
