{
  "id": "https://geolabs.github.io/bblocks-process-profiles/def/process-type/raster/radiometric-index",
  "type": "ProcessType",
  "prefLabel": "Compute radiometric indices.",
  "definition": "This application computes radiometric indices using the relevant channels of the input image. The output is a multi band image into which each channel is one of the selected indices.",
  "inScheme": "https://geolabs.github.io/bblocks-process-profiles/def/process-type",
  "status": "submitted",
  "phase": [
    "https://geolabs.github.io/bblocks-process-profiles/def/phase/scientific-computation"
  ],
  "profile": "ospd.process-profiles.raster.radiometric-index",
  "processDescription": {
    "id": "OTB.RadiometricIndices",
    "version": "1.0.0",
    "href": "https://host1.tb.geonovum.geolabs.fr/ogc-api/processes/OTB.RadiometricIndices"
  },
  "provenanceClass": "http://purl.org/wf4ever/wfprov#ProcessRun",
  "implementsProfile": "https://geolabs.github.io/bblocks-generic-profiles/def/implementation-profile/radiometric-index",
  "closeMatch": [
    "https://www.opengis.net/def/bblocks/ogc.openeo.processes.cubes.ndvi"
  ],
  "openeoEquivalence": {
    "level": "closeMatch",
    "rationale": "OTB.RadiometricIndices computes a *selectable set* of named indices (NDVI, NDWI, and many others via `channels` / `list`) from user-mapped spectral channels (`channels.red`, `channels.nir`, ...), only one of which (NDVI) has a dedicated openEO process (`ndvi`, which also expects band-role mapping via `nir`/`red` parameters). closeMatch, not exactMatch: openEO has no equivalent for the other indices this application can compute."
  }
}