{
  "id": "https://geolabs.github.io/bblocks-process-profiles/def/process-type/algae-bloom/download-band-sentinel2-stac-item",
  "type": "ProcessType",
  "prefLabel": "Downloads Sentinel-2 GeoTiff from STAC Item.",
  "definition": "Downloads the GeoTiff band from the Sentinel-2 product STAC Item using the requested band selection criteria. It is assumed that the referenced STAC Item contains the desired GeoTiff Asset with the 'common band name' associated to the band (see https://github.com/stac-extensions/eo#common-band-names).",
  "inScheme": "https://geolabs.github.io/bblocks-process-profiles/def/process-type",
  "status": "submitted",
  "phase": [
    "https://geolabs.github.io/bblocks-process-profiles/def/phase/data-retrieval"
  ],
  "profile": "ospd.process-profiles.algae-bloom.download-band-sentinel2-stac-item",
  "processDescription": {
    "id": "download-band-sentinel2-stac-item",
    "version": "1.1.0",
    "href": "https://ospd.example.org/ogc-api/processes/download-band-sentinel2-stac-item"
  },
  "plan": {
    "id": "https://ospd.example.org/ogc-api/processes/download-band-sentinel2-stac-item/package",
    "type": "Plan",
    "executionUnit": {
      "href": "https://github.com/crim-ca/ogc-ospd-phase1/raw/5edd4ec4cbd21e5fceb7c3f4b6c5d0ce809a57ea/ogc_app_pkg/download-band-sentinel2-stac-item.cwl",
      "type": "application/cwl+yaml",
      "rel": "http://www.opengis.net/def/rel/ogc/1.0/executionUnit"
    },
    "cwlClass": "CommandLineTool",
    "cwlId": "download-band-sentinel2-stac-item",
    "license": "https://spdx.org/licenses/CC-BY-NC-SA-4.0",
    "cctDependencies": [],
    "candidateCctDependencies": [
      "eoap.cct.string-format",
      "eoap.cct.stac"
    ]
  },
  "provenanceClass": "http://purl.org/wf4ever/wfprov#ProcessRun",
  "closeMatch": [
    "https://www.opengis.net/def/bblocks/ogc.openeo.processes.cubes.load_collection",
    "https://www.opengis.net/def/bblocks/ogc.openeo.processes.cubes.filter_bands"
  ],
  "relatedMatch": [
    "https://www.opengis.net/def/bblocks/ogc.openeo.types.band-name",
    "https://www.opengis.net/def/bblocks/ogc.openeo.types.stac"
  ],
  "openeoEquivalence": {
    "level": "closeMatch",
    "rationale": "Retrieves one band of one product: load_collection with `bands` (or filter_bands) over a single-item extent. The closest openEO process, `load_stac`, is only an openEO proposal and out of the register's scope. The band is chosen by Sentinel-2 band id (B01..B12), matched to STAC `eo:common_name` assets inside the tool, where openEO uses collection band names directly."
  }
}