{
  "id": "https://geolabs.github.io/bblocks-process-profiles/def/process-type/sqlmm/crosses",
  "type": "ProcessType",
  "prefLabel": "Crosses test",
  "definition": "This service shall return a true value if and only if the geometries g1 and g2 share some but neither is containe in the other, and the dimension of the intersection is less than that of both of the geometries.",
  "inScheme": "https://geolabs.github.io/bblocks-process-profiles/def/process-type",
  "status": "submitted",
  "phase": [
    "https://geolabs.github.io/bblocks-process-profiles/def/phase/scientific-computation"
  ],
  "profile": "ospd.process-profiles.sqlmm.crosses",
  "processDescription": {
    "id": "Crosses",
    "version": "2.0.0",
    "href": "https://host1.tb.geonovum.geolabs.fr/ogc-api/processes/Crosses"
  },
  "provenanceClass": "http://purl.org/wf4ever/wfprov#ProcessRun",
  "implementsProfile": "https://geolabs.github.io/bblocks-generic-profiles/def/implementation-profile/crosses",
  "openeoEquivalence": {
    "level": "none",
    "rationale": "No openEO process for this SQL/MM predicate in the published bblocks-openeo register."
  }
}
