{
  "id": "https://geolabs.github.io/bblocks-process-profiles/def/process-type/water-bodies/crop",
  "type": "ProcessType",
  "prefLabel": "Crop a Sentinel-2 COG band to an area of interest",
  "definition": "Cloud-native windowed read of one Sentinel-2 COG band asset of a STAC item, cropped to the area of interest and reprojected to the requested CRS.",
  "inScheme": "https://geolabs.github.io/bblocks-process-profiles/def/process-type",
  "status": "submitted",
  "phase": [
    "https://geolabs.github.io/bblocks-process-profiles/def/phase/data-retrieval"
  ],
  "profile": "ospd.process-profiles.water-bodies.crop",
  "processDescription": {
    "id": "crop",
    "version": "1.4.1",
    "href": "https://ospd.example.org/ogc-api/processes/crop"
  },
  "plan": {
    "id": "https://ospd.example.org/ogc-api/processes/crop/package",
    "type": "Plan",
    "executionUnit": {
      "href": "https://github.com/GeoLabs/ogc-eo-application-package-hands-on/raw/f47258567ddf8efbc7c33fd1ec277e4f1b454883/water-bodies/app-pkg-multiple/crop.cwl",
      "type": "application/cwl+yaml",
      "rel": "http://www.opengis.net/def/rel/ogc/1.0/executionUnit"
    },
    "cwlClass": "CommandLineTool",
    "cwlId": "crop",
    "license": "https://spdx.org/licenses/CC-BY-SA-4.0",
    "cctDependencies": [],
    "candidateCctDependencies": [
      "eoap.cct.bbox",
      "eoap.cct.stac",
      "eoap.cct.string-format"
    ]
  },
  "provenanceClass": "http://purl.org/wf4ever/wfprov#ProcessRun",
  "closeMatch": [
    "https://www.opengis.net/def/bblocks/ogc.openeo.processes.cubes.load_collection",
    "https://www.opengis.net/def/bblocks/ogc.openeo.processes.cubes.filter_bands"
  ],
  "openeoEquivalence": {
    "level": "closeMatch",
    "rationale": "load_collection with a spatial_extent (aoi) and a single band selected (filter_bands); the STAC item is given by URL rather than resolved by collection/date/bbox search, and the windowed COG read (no full download) is an implementation detail openEO back-ends make transparently."
  }
}
