{
  "id": "https://geolabs.github.io/bblocks-process-profiles/def/process-type/sqlmm/area",
  "type": "ProcessType",
  "prefLabel": "Compute geometry area.",
  "definition": "Computes the area of a geometry",
  "inScheme": "https://geolabs.github.io/bblocks-process-profiles/def/process-type",
  "status": "submitted",
  "phase": [
    "https://geolabs.github.io/bblocks-process-profiles/def/phase/scientific-computation"
  ],
  "profile": "ospd.process-profiles.sqlmm.area",
  "processDescription": {
    "id": "GetArea",
    "version": "2.0.0",
    "href": "https://host1.tb.geonovum.geolabs.fr/ogc-api/processes/GetArea"
  },
  "provenanceClass": "http://purl.org/wf4ever/wfprov#ProcessRun",
  "implementsProfile": "https://geolabs.github.io/bblocks-generic-profiles/def/implementation-profile/area",
  "openeoEquivalence": {
    "level": "none",
    "rationale": "No openEO process computes the area of a vector geometry in the published bblocks-openeo register."
  }
}
