{
  "id": "https://geolabs.github.io/bblocks-process-profiles/def/process-type/raster/extent",
  "type": "ProcessType",
  "prefLabel": "Extracts an image envelope.",
  "definition": "Build a vector data containing the image envelope polygon. Useful for some projection, you can set the polygon with more points with the sr parameter. This filter supports user-specified output projection. If no projection is defined, the standard WGS84 projection will be used.",
  "inScheme": "https://geolabs.github.io/bblocks-process-profiles/def/process-type",
  "status": "submitted",
  "phase": [
    "https://geolabs.github.io/bblocks-process-profiles/def/phase/export-aggregation"
  ],
  "profile": "ospd.process-profiles.raster.extent",
  "processDescription": {
    "id": "OTB.ImageEnvelope",
    "version": "1.0.0",
    "href": "https://host1.tb.geonovum.geolabs.fr/ogc-api/processes/OTB.ImageEnvelope"
  },
  "provenanceClass": "http://purl.org/wf4ever/wfprov#ProcessRun",
  "implementsProfile": "https://geolabs.github.io/bblocks-generic-profiles/def/implementation-profile/raster-extent",
  "openeoEquivalence": {
    "level": "none",
    "rationale": "No openEO process computes the bounding envelope of a raster/data cube in the published bblocks-openeo register (filter_bbox takes a bbox as input to filter by, it does not compute one as output)."
  }
}