{
  "id": "https://geolabs.github.io/bblocks-process-profiles/def/process-type/kindgrove-steps/export-stac",
  "type": "ProcessType",
  "prefLabel": "Plot the biomass map and export a STAC catalog",
  "definition": "Plots the biomass map and exports the mangrove analysis results as a STAC Catalog.",
  "inScheme": "https://geolabs.github.io/bblocks-process-profiles/def/process-type",
  "status": "submitted",
  "phase": [
    "https://geolabs.github.io/bblocks-process-profiles/def/phase/export-aggregation"
  ],
  "profile": "ospd.process-profiles.kindgrove-steps.export-stac",
  "processDescription": {
    "id": "export_stac",
    "version": "0.1.0",
    "href": "https://ospd.example.org/ogc-api/processes/export_stac"
  },
  "plan": {
    "id": "https://ospd.example.org/ogc-api/processes/export_stac/package",
    "type": "Plan",
    "executionUnit": {
      "href": "https://github.com/GeoLabs/KindGrove/releases/download/v0.0.2-rc2/mangrove-workflow-steps.cwl#export_stac",
      "type": "application/cwl+yaml",
      "rel": "http://www.opengis.net/def/rel/ogc/1.0/executionUnit"
    },
    "cwlClass": "CommandLineTool",
    "cwlId": "export_stac",
    "license": "https://spdx.org/licenses/CC-BY-NC-SA-4.0",
    "cctDependencies": [],
    "candidateCctDependencies": [
      "eoap.cct.stac"
    ]
  },
  "provenanceClass": "http://purl.org/wf4ever/wfprov#ProcessRun",
  "closeMatch": [
    "https://www.opengis.net/def/bblocks/ogc.openeo.processes.cubes.save_result"
  ],
  "openeoEquivalence": {
    "level": "closeMatch",
    "rationale": "Writes the final rasters and summaries to a self-describing STAC output, plus a quicklook PNG rendering; save_result's STAC output option is the closest openEO equivalent, same partial match as `algae-bloom.plot-image` and `water-bodies.stac`."
  }
}